<?xml version="1.0" encoding="UTF-8"?>
<xs:schema xmlns:xs="http://www.w3.org/2001/XMLSchema">

    <xs:element name="student">
        <xs:complexType>
            <xs:sequence>
                <xs:element name="name" type="xs:string" />
                <xs:element name="id" type="xs:int" />
                <xs:element name="department" type="xs:string" />
                <xs:element name="subjects">
                    <xs:complexType>
                        <xs:sequence>
                            <xs:element name="subject" maxOccurs="unbounded" minOccurs="1">
                                <xs:complexType>
                                    <xs:sequence>
                                        <xs:element name="code" type="xs:string" />
                                        <xs:element name="name" type="xs:string" />
                                        <xs:element name="credits" type="xs:int" />
                                    </xs:sequence>
                                </xs:complexType>
                            </xs:element>
                        </xs:sequence>
                    </xs:complexType>
                </xs:element>
            </xs:sequence>
        </xs:complexType>
    </xs:element>
    
</xs:schema>