<?xml version="1.0" encoding="UTF-8"?>
<student xmlns:xsi="http://www.w3.org/2001/XMLSchema-instance"
    xsi:noNamespaceSchemaLocation="student.xsd">
    <name>Suhaina Fathima M</name>
    <id>46</id>
    <department>Computer Science Engineering</department>
    <subjects>
        <subject>
            <code>22CS101</code>
            <name>Introduction to Programming</name>
            <credits>4</credits>
        </subject>
        <subject>
            <code>22CS102</code>
            <name>Data Structures</name>
            <credits>3</credits>
        </subject>
        <subject>
            <code>22SS501</code>
            <name>Web Technology</name>
            <credits>3</credits>
        </subject>
    </subjects>
</student>